id,text
443,"Despite what I just said, on Matthew Read's answer, I'd support merging ""Ubuntu"" and ""Linux"" -- if we aren't going to distinguish every single operating system by version (which sounds to me like crazy talk ... every Mac OS? Every Linux distro and release? Eeek.) there's no reason to break out Ubuntu from Linux."
860,This if fine by me. Martin covers all the points I was going to say. Pass on over the good questions. :)
2232,"I don't know if there is general SE guidance on this, but I would say yes &mdash; clear cut cases seem like a good place for flags.  This site is not at the point where moderators need to heavily triage flags, as yet.  That said, I also go fully through most queues regularly, so a flag is not strictly necessary."
14,"I'm going to say that this depends on how specific it is.  At the least, it should be community wiki.  If it isn't specific enough, then it should be closed."
1152,"Yes, why not. There's no reason why we shouldn't opt-in. If Android likes to be cool, why its Enthusiasts can't. Go for it without turning back..."
