id,text
2148,"power tag has been burninated! Some analysis: Creating power-button should be a reasonable choice, given that there are not too many physical/hardware buttons on Android device, while it can also help categorizing the question in better scope. Possible search query to help retagging: power button is:q -[power-button] (sorted by score, exclude questions already tagged with it). If you want to participate in retagging, please ensure that the question is really asking about power button issue."
697,"I really like the idea, I think there are a lot!! Here there are some of them: Block all sounds going out through speaker when headphone connected How can I fix the WiFi button or prevent WiFi errors when turning it off and back on?"
2405,"I think it's important to look past the words the questioner happened to use, to see what the intent of the questioner is, and I wish close-voters would put a little more thought into that. This isn't 3-2-1, and you shouldn't lose everything just because you happened to use the magic word ""app"" in your question. Recommendation questions are opinion-based. They ask for lists of answers, and they tend to get spam answers as a result. The answers are less useful than Google Play search results, because they go out of date quickly. This is why we don't like them on the site. Which is the best music player? or Is there a good third-party SMS app? These are simplified examples of bad questions. What kind of answer will they get? A million answers saying ""I like such-and-such app, it's the best"" with no justification. An answer with a one-off copy-paste of Izzy's app lists, which will slowly go out of date or need editors to keep updating it over time. I have a bunch of CSV files in Google Drive and I need to download them when they change and add the results up. Is there an app for that? or I play games on my tablet with my kid ""helping"" sitting on my knee. He often grabs the rim of the tablet and pokes the volume button and makes it really loud. I need the volume buttons turned off when I'm playing a game. Is there an app for that? This doesn't seem like a ""recommendation"" question to me. What kind of answer will it get? There still might be more than one. It might say, ""Use such-and-such app, it can do this out of the box,"" but more likely, it'll say ""You have to install Pushbullet or IFTTT to find out when the file changes, then use Tasker to schedule downloading them and open Excel for Android to load the CSV files,"" or ""You need a custom ROM for this. Lineage can do it."" The difference is, you can replace ""Is there an app?"" with ""How do I solve my problem?"" without really changing the meaning of the question. In the recommendation questions, you can't do that. I think that's the crucial difference. If I find a question like this second pair of examples in the close vote queue, I'll typically make that edit so that people don't close the question, but I don't think the edit should be needed. Just because someone thought an app is the most likely solution to their problem, that doesn't turn a good problem-solving question into a recommendation question. I think we should all apply that test in our head: can I replace ""is there an app?"" with ""is there a solution?"" without changing the meaning of the question."
1094,"If you ""Favorite"" a question you will get notifications of updates. That's the ""star"" icon under the voting buttons. See also: How do favorite questions work?"
1915,"Two things I'd mention: The primary top-left android logo is too similar in colour to the background The Ask Question button could be highlighted, à la a floating action button, in a different colour and slightly raised."
